<?xml version="1.0"?>
<!--
/**
 * Copyright Â© Magento, Inc. All rights reserved.
 * See COPYING.txt for license details.
 */
-->
<scenario xmlns:xsi="http://www.w3.org/2001/XMLSchema-instance" xsi:noNamespaceSchemaLocation="../config/scenario.xsd">
    <step name="is-deploy-failed" type="Magento\MagentoCloud\Step\PostDeploy\DeployFailed"/>
    <step name="validate-config" type="Magento\MagentoCloud\Step\ValidateConfiguration">
        <arguments>
            <argument name="logger" xsi:type="object">Psr\Log\LoggerInterface</argument>
            <argument name="validators" xsi:type="array">
                <item name="300" xsi:type="array">
                    <item name="debug-logging" xsi:type="object">Magento\MagentoCloud\Config\Validator\Deploy\DebugLogging</item>
                </item>
            </argument>
        </arguments>
    </step>
    <step name="enable-cron" type="Magento\MagentoCloud\Step\PostDeploy\EnableCron"/>
    <step name="backup" type="Magento\MagentoCloud\Step\PostDeploy\Backup"/>
    <step name="clean-cache" type="Magento\MagentoCloud\Step\PostDeploy\CleanCache"/>
    <step name="warm-up" type="Magento\MagentoCloud\Step\PostDeploy\WarmUp"/>
    <step name="time-to-first-byte" type="Magento\MagentoCloud\Step\PostDeploy\TimeToFirstByte"/>
</scenario>
