<?xml version="1.0"?>
<scenario xmlns:xsi="http://www.w3.org/2001/XMLSchema-instance" xsi:noNamespaceSchemaLocation="urn:magento:ece-tools:config/scenario.xsd">
    <step name="pre-build" type="Magento\MagentoCloud\Step\Build\PreBuild" priority="100"/>
    <step name="apply-patches" type="Magento\MagentoCloud\Step\Build\ApplyPatches" priority="150"/>
    <step name="set-production-mode" type="Magento\MagentoCloud\Step\SetProductionMode" priority="200"/>
    <step name="validate-configuration" type="Magento\MagentoCloud\Step\ValidateConfiguration" priority="300">
        <arguments>
            <argument name="logger" xsi:type="object">Psr\Log\LoggerInterface</argument>
            <argument name="validators" xsi:type="array">
                <item name="critical" xsi:type="array">
                    <item name="composer" xsi:type="object" priority="100">Magento\MagentoCloud\Config\Validator\Build\ComposerFile</item>
                    <item name="stage-config" xsi:type="object" priority="200">Magento\MagentoCloud\Config\Validator\Build\StageConfig</item>
                    <item name="magento-app-yaml" xsi:type="object" priority="300">Magento\MagentoCloud\Config\Validator\Build\MagentoAppYaml</item>
                </item>
                <item name="warning" xsi:type="array">
                    <item name="config-file-exists" xsi:type="object" priority="100">Magento\MagentoCloud\Config\Validator\Build\ConfigFileExists</item>
                    <item name="opcache-exclude-paths" xsi:type="object" priority="100">Magento\MagentoCloud\Config\Validator\Build\OpcacheExcludePaths</item>
                    <item name="deprecated-ini" xsi:type="object" priority="200">Magento\MagentoCloud\Config\Validator\Build\UnsupportedBuildOptionsIni</item>
                    <item name="modules-exists" xsi:type="object" priority="300">Magento\MagentoCloud\Config\Validator\Build\ModulesExists</item>
                    <item name="appropriate-version" xsi:type="object" priority="400">Magento\MagentoCloud\Config\Validator\Build\AppropriateVersion</item>
                    <item name="cloud-variables" xsi:type="object" priority="450">Magento\MagentoCloud\Config\Validator\Deploy\MagentoCloudVariables</item>
                    <item name="scd-options-ignorance" xsi:type="object" priority="500">Magento\MagentoCloud\Config\Validator\Build\ScdOptionsIgnorance</item>
                    <item name="ideal-state" xsi:type="object" priority="600">Magento\MagentoCloud\Config\Validator\IdealState</item>
                </item>
            </argument>
        </arguments>
    </step>
    <step name="refresh-modules" type="Magento\MagentoCloud\Step\Build\RefreshModules" priority="400"/>
    <step name="copy-pub-static" type="Magento\MagentoCloud\Step\Build\CopyPubStatic" priority="500"/>
    <step name="set-report-dir-nesting-level" type="Magento\MagentoCloud\Step\Build\SetReportDirNestingLevel" priority="700"/>
    <step name="marshall-files" type="Magento\MagentoCloud\Step\Build\MarshallFiles" priority="800"/>
    <step name="copy-sample-data" type="Magento\MagentoCloud\Step\Build\CopySampleData" priority="900"/>
    <step name="enable-eventing" type="Magento\MagentoCloud\Step\Build\EnableEventing" priority="950" />
    <step name="enable-webhooks" type="Magento\MagentoCloud\Step\Build\EnableWebhooks" priority="975" />
    <step name="compile-di" type="Magento\MagentoCloud\Step\Build\CompileDi" priority="1000"/>
    <step name="dump-autoload" type="Magento\MagentoCloud\Step\Build\ComposerDumpAutoload" priority="1100"/>
    <step name="deploy-static-content" type="Magento\MagentoCloud\Step\Build\DeployStaticContent" priority="1200">
        <arguments>
            <argument name="logger" xsi:type="object">Psr\Log\LoggerInterface</argument>
            <argument name="flag-manager" xsi:type="object">Magento\MagentoCloud\Filesystem\Flag\Manager</argument>
            <argument name="scd-on-build" xsi:type="object">Magento\MagentoCloud\Config\Validator\GlobalStage\ScdOnBuild</argument>
            <argument name="steps" xsi:type="array">
                <item name="generate" xsi:type="object" priority="100">Magento\MagentoCloud\Step\Build\DeployStaticContent\Generate</item>
            </argument>
        </arguments>
    </step>
    <step name="run-baler" type="Magento\MagentoCloud\Step\Build\RunBaler" priority="1300">
        <arguments>
            <argument name="logger" xsi:type="object">Psr\Log\LoggerInterface</argument>
            <argument name="build-config" xsi:type="object">Magento\MagentoCloud\Config\Stage\BuildInterface</argument>
            <argument name="flag-manager" xsi:type="object">Magento\MagentoCloud\Filesystem\Flag\Manager</argument>
            <argument name="baler-validator" xsi:type="object">Magento\MagentoCloud\Config\Validator\Build\BalerSupport</argument>
            <argument name="shell" xsi:type="object">Magento\MagentoCloud\Shell\ShellInterface</argument>
        </arguments>
    </step>
</scenario>
