<?xml version="1.0"?>
<!--
/**
 * Copyright Â© Magento, Inc. All rights reserved.
 * See COPYING.txt for license details.
 */
-->
<scenario xmlns:xsi="http://www.w3.org/2001/XMLSchema-instance" xsi:noNamespaceSchemaLocation="../config/scenario.xsd">
    <step name="remove-deploy-failed-flag" type="Magento\MagentoCloud\Process\Deploy\RemoveDeployFailedFlag"/>
    <step name="pre-deploy" type="Magento\MagentoCloud\Process\Deploy\PreDeploy">
        <arguments>
            <argument name="processes" xsi:type="array">
                <item name="cache" xsi:type="object">Magento\MagentoCloud\Process\Deploy\PreDeploy\ConfigUpdate\Cache</item>
                <item name="clean-static-content" xsi:type="object">Magento\MagentoCloud\Process\Deploy\PreDeploy\CleanStaticContent</item>
                <item name="clean-view-preprocessed" xsi:type="object">Magento\MagentoCloud\Process\Deploy\PreDeploy\CleanViewPreprocessed</item>
                <item name="clean-redis-cache" xsi:type="object">Magento\MagentoCloud\Process\Deploy\PreDeploy\CleanRedisCache</item>
                <item name="clean-file-cache" xsi:type="object">Magento\MagentoCloud\Process\Deploy\PreDeploy\CleanFileCache</item>
                <item name="restore-writable-dirs" xsi:type="object">Magento\MagentoCloud\Process\Deploy\PreDeploy\RestoreWritableDirectories</item>
                <item name="set-production-mode" xsi:type="object">Magento\MagentoCloud\Process\SetProductionMode</item>
            </argument>
        </arguments>
    </step>
    <step name="enable-maintenance-mode" type="Magento\MagentoCloud\Process\EnableMaintenanceMode"/>
    <step name="disable-cron" type="Magento\MagentoCloud\Process\Deploy\DisableCron"/>
    <step name="validate-config" type="Magento\MagentoCloud\Process\ValidateConfiguration">
        <arguments>
            <argument name="validators" xsi:type="array">
                <item name="500" xsi:type="array">
                    <item name="database-configuration" xsi:type="object">Magento\MagentoCloud\Config\Validator\Deploy\DatabaseConfiguration</item>
                    <item name="search-configuration" xsi:type="object">Magento\MagentoCloud\Config\Validator\Deploy\SearchConfiguration</item>
                    <item name="resource-configuration" xsi:type="object">Magento\MagentoCloud\Config\Validator\Deploy\ResourceConfiguration</item>
                    <item name="session-configuration" xsi:type="object">Magento\MagentoCloud\Config\Validator\Deploy\SessionConfiguration</item>
                    <item name="elasticsuite-integrity" xsi:type="object">Magento\MagentoCloud\Config\Validator\Deploy\ElasticSuiteIntegrity</item>
                </item>
                <item name="300" xsi:type="array">
                    <item name="admin-data" xsi:type="object">Magento\MagentoCloud\Config\Validator\Deploy\AdminData</item>
                    <item name="php-version" xsi:type="object">Magento\MagentoCloud\Config\Validator\Deploy\PhpVersion</item>
                    <item name="solr-integrity" xsi:type="object">Magento\MagentoCloud\Config\Validator\Deploy\SolrIntegrity</item>
                    <item name="es-usage" xsi:type="object">Magento\MagentoCloud\Config\Validator\Deploy\ElasticSearchUsage</item>
                    <item name="es-version" xsi:type="object">Magento\MagentoCloud\Config\Validator\Deploy\ElasticSearchVersion</item>
                    <item name="appropriate-version" xsi:type="object">Magento\MagentoCloud\Config\Validator\Deploy\AppropriateVersion</item>
                    <item name="scd-options-ignorance" xsi:type="object">Magento\MagentoCloud\Config\Validator\Deploy\ScdOptionsIgnorance</item>
                    <item name="deprecated-variables" xsi:type="object">Magento\MagentoCloud\Config\Validator\Deploy\DeprecatedVariables</item>
                    <item name="raw-env-variable" xsi:type="object">Magento\MagentoCloud\Config\Validator\Deploy\RawEnvVariable</item>
                    <item name="cloud-variables" xsi:type="object">Magento\MagentoCloud\Config\Validator\Deploy\MagentoCloudVariables</item>
                    <item name="json-format-variable " xsi:type="object">Magento\MagentoCloud\Config\Validator\Deploy\JsonFormatVariable</item>
                    <item name="service-version" xsi:type="object">Magento\MagentoCloud\Config\Validator\Deploy\ServiceVersion</item>
                </item>
            </argument>
        </arguments>
    </step>
    <step name="unlock-cron-jobs" type="Magento\MagentoCloud\Process\Deploy\UnlockCronJobs"/>
    <step name="set-crypt-key" type="Magento\MagentoCloud\Process\Deploy\SetCryptKey"/>
    <step name="install-update" type="Magento\MagentoCloud\Process\Deploy\InstallUpdate">
        <arguments>
            <argument name="installProcesses" xsi:type="array">
                <item name="setup" xsi:type="object">Magento\MagentoCloud\Process\Deploy\InstallUpdate\Install\Setup</item>
                <!-- Config update start -->
                <item name="prepare-config" xsi:type="object">Magento\MagentoCloud\Process\Deploy\InstallUpdate\ConfigUpdate\PrepareConfig</item>
                <item name="cron-consumer-runner" xsi:type="object">Magento\MagentoCloud\Process\Deploy\InstallUpdate\ConfigUpdate\CronConsumersRunner</item>
                <item name="db-connection" xsi:type="object">Magento\MagentoCloud\Process\Deploy\InstallUpdate\ConfigUpdate\DbConnection</item>
                <item name="amqp" xsi:type="object">Magento\MagentoCloud\Process\Deploy\InstallUpdate\ConfigUpdate\Amqp</item>
                <item name="session" xsi:type="object">Magento\MagentoCloud\Process\Deploy\InstallUpdate\ConfigUpdate\Session</item>
                <item name="search-engine" xsi:type="object">Magento\MagentoCloud\Process\Deploy\InstallUpdate\ConfigUpdate\SearchEngine</item>
                <item name="urls" xsi:type="object">Magento\MagentoCloud\Process\Deploy\InstallUpdate\ConfigUpdate\Urls</item>
                <item name="document-root" xsi:type="object">Magento\MagentoCloud\Process\Deploy\InstallUpdate\ConfigUpdate\DocumentRoot</item>
                <item name="lock" xsi:type="object">Magento\MagentoCloud\Process\Deploy\InstallUpdate\ConfigUpdate\Lock</item>
                <!-- Config update end -->
                <item name="config-import" xsi:type="object">Magento\MagentoCloud\Process\Deploy\InstallUpdate\Install\ConfigImport</item>
                <item name="reset-password" xsi:type="object">Magento\MagentoCloud\Process\Deploy\InstallUpdate\Install\ResetPassword</item>
            </argument>
            <argument name="updateProcesses" xsi:type="array">
                <!-- Config update start -->
                <item name="prepare-config" xsi:type="object">Magento\MagentoCloud\Process\Deploy\InstallUpdate\ConfigUpdate\PrepareConfig</item>
                <item name="cron-consumer-runner" xsi:type="object">Magento\MagentoCloud\Process\Deploy\InstallUpdate\ConfigUpdate\CronConsumersRunner</item>
                <item name="db-connection" xsi:type="object">Magento\MagentoCloud\Process\Deploy\InstallUpdate\ConfigUpdate\DbConnection</item>
                <item name="amqp" xsi:type="object">Magento\MagentoCloud\Process\Deploy\InstallUpdate\ConfigUpdate\Amqp</item>
                <item name="session" xsi:type="object">Magento\MagentoCloud\Process\Deploy\InstallUpdate\ConfigUpdate\Session</item>
                <item name="search-engine" xsi:type="object">Magento\MagentoCloud\Process\Deploy\InstallUpdate\ConfigUpdate\SearchEngine</item>
                <item name="urls" xsi:type="object">Magento\MagentoCloud\Process\Deploy\InstallUpdate\ConfigUpdate\Urls</item>
                <item name="document-root" xsi:type="object">Magento\MagentoCloud\Process\Deploy\InstallUpdate\ConfigUpdate\DocumentRoot</item>
                <item name="lock" xsi:type="object">Magento\MagentoCloud\Process\Deploy\InstallUpdate\ConfigUpdate\Lock</item>
                <!-- Config update end -->
                <item name="set-admin-url" xsi:type="object">Magento\MagentoCloud\Process\Deploy\InstallUpdate\Update\SetAdminUrl</item>
                <item name="setup" xsi:type="object">Magento\MagentoCloud\Process\Deploy\InstallUpdate\Update\Setup</item>
            </argument>
        </arguments>
    </step>
    <step name="deploy-static-content" type="Magento\MagentoCloud\Process\Deploy\DeployStaticContent">
        <arguments>
            <argument name="processes" xsi:type="array">
                <item name="generate" xsi:type="object">Magento\MagentoCloud\Process\Deploy\DeployStaticContent\Generate</item>
            </argument>
        </arguments>
    </step>
    <step name="compress-static-content" type="Magento\MagentoCloud\Process\Deploy\CompressStaticContent"/>
    <step name="disable-google-analytics" type="Magento\MagentoCloud\Process\Deploy\DisableGoogleAnalytics"/>
    <!-- This process runs processes if only post_deploy hook is not configured -->
    <step name="deploy-complete" type="Magento\MagentoCloud\Process\Deploy\DeployCompletion">
        <arguments>
            <argument name="processes" xsi:type="array">
                <item name="enable-cron" xsi:type="object">Magento\MagentoCloud\Process\PostDeploy\EnableCron</item>
                <item name="backup" xsi:type="object">Magento\MagentoCloud\Process\PostDeploy\Backup</item>
                <item name="clean-cache" xsi:type="object">Magento\MagentoCloud\Process\PostDeploy\CleanCache</item>
            </argument>
        </arguments>
    </step>
    <step name="disable-maintenance-mode" type="Magento\MagentoCloud\Process\DisableMaintenanceMode"/>
</scenario>
