<?xml version="1.0"?>
<!--
/**
 * Copyright Â© Magento, Inc. All rights reserved.
 * See COPYING.txt for license details.
 */
-->
<scenario xmlns:xsi="http://www.w3.org/2001/XMLSchema-instance" xsi:noNamespaceSchemaLocation="../../config/scenario.xsd">
    <step name="compress-static-content" type="Magento\MagentoCloud\Process\Build\CompressStaticContent"/>
    <step name="clear-init-directory" type="Magento\MagentoCloud\Process\Build\ClearInitDirectory"/>
    <step name="backup-data" type="Magento\MagentoCloud\Process\Build\BackupData">
        <arguments>
            <argument name="processes" xsi:type="array">
                <item name="static-content" xsi:type="object">Magento\MagentoCloud\Process\Build\BackupData\StaticContent</item>
                <item name="writable-dirs" xsi:type="object">Magento\MagentoCloud\Process\Build\BackupData\WritableDirectories</item>
            </argument>
        </arguments>
    </step>
</scenario>
